{
  "$schema": "https://json-schema.org/draft/2020-12/schema",
  "$id": "https://open-neko.github.io/plugins/marketplace.schema.json",
  "title": "OpenNeko plugin marketplace",
  "description": "Single-file catalog of plugins, modeled on Claude Code's marketplace.json plus the security fields the OpenNeko CLI enforces (integrity, permissions, capabilities). Publish your own marketplace.json at a stable URL and operators can trust it with `openneko marketplace add <url>`.",
  "type": "object",
  "required": ["name", "owner", "description", "plugins"],
  "additionalProperties": true,
  "properties": {
    "$schema": { "type": "string" },
    "name": {
      "type": "string",
      "minLength": 1,
      "maxLength": 80,
      "description": "Human-readable name. Shown when the operator adds this marketplace."
    },
    "owner": {
      "type": "string",
      "minLength": 1,
      "description": "GitHub org / individual / company that publishes this marketplace."
    },
    "homepage": { "type": "string", "format": "uri" },
    "description": {
      "type": "string",
      "minLength": 10,
      "maxLength": 800
    },
    "plugins": {
      "type": "array",
      "items": { "$ref": "#/$defs/plugin" }
    }
  },
  "$defs": {
    "plugin": {
      "type": "object",
      "required": ["name", "title", "description", "source", "versions"],
      "additionalProperties": false,
      "properties": {
        "name": {
          "type": "string",
          "pattern": "^(@[a-z0-9-]+/)?[a-z0-9][a-z0-9-_]*$",
          "description": "npm package name."
        },
        "title": { "type": "string", "minLength": 3, "maxLength": 80 },
        "description": { "type": "string", "minLength": 10, "maxLength": 800 },
        "source": {
          "type": "string",
          "format": "uri",
          "pattern": "^https://(github\\.com|gitlab\\.com|codeberg\\.org)/"
        },
        "homepage": { "type": "string", "format": "uri" },
        "maintainers": {
          "type": "array",
          "minItems": 1,
          "items": {
            "type": "object",
            "required": ["name"],
            "additionalProperties": false,
            "properties": {
              "name": { "type": "string" },
              "url": { "type": "string", "format": "uri" }
            }
          }
        },
        "versions": {
          "type": "array",
          "minItems": 1,
          "items": { "$ref": "#/$defs/version" }
        }
      }
    },
    "version": {
      "type": "object",
      "required": ["version", "integrity", "permissions", "capabilities", "publishedAt"],
      "additionalProperties": false,
      "properties": {
        "version": {
          "type": "string",
          "pattern": "^\\d+\\.\\d+\\.\\d+(-[0-9A-Za-z-.]+)?$",
          "description": "Pinned semver — no ranges."
        },
        "integrity": {
          "type": "string",
          "pattern": "^sha512-[A-Za-z0-9+/=]+$",
          "description": "Pinned npm dist.integrity hash. Use the all-`a` placeholder pattern ONLY in combination with `draft: true` while the package is still pre-publish."
        },
        "permissions": { "$ref": "#/$defs/permissions" },
        "capabilities": { "$ref": "#/$defs/capabilities" },
        "publishedAt": { "type": "string", "format": "date" },
        "yanked": { "type": "boolean", "default": false },
        "yanked_reason": { "type": "string" },
        "draft": {
          "type": "boolean",
          "default": false,
          "description": "Set to true when the version isn't on npm yet (chicken-and-egg case for a brand-new package whose first publish hasn't fired). `validate-live` skips every live check for draft entries — they're treated as informational. Flip to false and pin the real integrity hash once the publish workflow has succeeded."
        },
        "provenanceWaived": {
          "type": "boolean",
          "default": false,
          "description": "Set to true for legacy versions that were published before the publish workflow started using --provenance. `validate-live` still enforces integrity but skips the provenance check. Don't use on new versions — bump and re-publish with --provenance instead."
        }
      }
    },
    "permissions": {
      "type": "object",
      "description": "What the plugin needs from the runtime: outbound network hosts and operator-supplied env vars. Same shape lives in the installed manifest entry.",
      "additionalProperties": false,
      "properties": {
        "network": {
          "type": "array",
          "default": [],
          "items": {
            "type": "string",
            "pattern": "^[a-z0-9*]([a-z0-9-.*])*[a-z0-9*]$"
          },
          "description": "Hostnames the sandbox is allowed to reach. Enforced at the VM boundary."
        },
        "env": {
          "type": "array",
          "default": [],
          "items": { "$ref": "#/$defs/envRequirement" },
          "description": "Env vars the operator must supply. `openneko install` prompts for required ones and refuses to complete if missing."
        }
      }
    },
    "envRequirement": {
      "type": "object",
      "required": ["key", "description"],
      "additionalProperties": false,
      "properties": {
        "key": {
          "type": "string",
          "pattern": "^[A-Z][A-Z0-9_]*$",
          "maxLength": 64,
          "description": "UPPER_SNAKE_CASE env var name the plugin reads."
        },
        "required": { "type": "boolean", "default": true },
        "secret": {
          "type": "boolean",
          "default": true,
          "description": "Hide the value at prompt; the CLI will not echo it back."
        },
        "inject": {
          "enum": ["egress", "box"],
          "description": "How a secret reaches the plugin VM. 'egress': held gateway-side and substituted by the proxy onto outbound requests — the box sees only a placeholder (for credentials sent to an external API, e.g. a bot token). 'box' (default): the value lives in the VM, for secrets compared locally and never sent out (e.g. a webhook signing secret)."
        },
        "autogenerate": {
          "type": "boolean",
          "default": false,
          "description": "The host mints this value itself (48 random bytes, base64url) at install/load and stores it in the secrets file — the operator is never prompted and never sees it. For purely internal secrets like HMAC signing keys."
        },
        "description": {
          "type": "string",
          "minLength": 1,
          "maxLength": 280
        }
      }
    },
    "capabilities": {
      "type": "object",
      "description": "Surfaces this plugin contributes. The keyset declares what the plugin does — `action`, `auth`, and/or `connect`. At least one must be present.",
      "additionalProperties": false,
      "minProperties": 1,
      "properties": {
        "action": {
          "type": "object",
          "description": "The plugin contributes one or more named action handlers.",
          "required": ["kinds"],
          "additionalProperties": false,
          "properties": {
            "kinds": {
              "type": "array",
              "minItems": 1,
              "items": { "$ref": "#/$defs/actionDeclaration" }
            }
          }
        },
        "auth": {
          "type": "object",
          "description": "The plugin acts as the SSO provider. Singleton — only one installed plugin may declare this.",
          "additionalProperties": false,
          "properties": {
            "providerLabel": {
              "type": "string",
              "minLength": 1,
              "description": "Short label rendered on the sign-in button (e.g. \"Scalekit\", \"Okta\")."
            },
            "provisioning": {
              "type": "string",
              "enum": ["automatic", "manual"],
              "default": "automatic",
              "description": "automatic: IdP-attested identity — the core may create an app_user on first sign-in. manual: self-asserted identity (e.g. magic link) — the core only signs in users an admin pre-provisioned and silently drops unknown emails."
            },
            "loginHintRequired": {
              "type": "boolean",
              "default": false,
              "description": "begin_auth is unusable without a loginHint (e.g. magic link needs the email). The sign-in page requires the email field and the begin route rejects hint-less requests."
            }
          }
        },
        "connect": {
          "type": "object",
          "description": "The plugin offers a per-operator OAuth connector. Non-singleton — any number of installed plugins may declare this, and each operator connects independently. Credentials land in the per-operator section of the secrets store.",
          "required": ["providerLabel", "scopes"],
          "additionalProperties": false,
          "properties": {
            "providerLabel": {
              "type": "string",
              "minLength": 1,
              "description": "Display label shown on the Connect button + status row (e.g. \"Google Workspace\", \"GitHub\")."
            },
            "scopes": {
              "type": "array",
              "minItems": 1,
              "items": { "type": "string", "minLength": 1, "maxLength": 256 },
              "description": "OAuth scopes the connector will request at consent time."
            },
            "flow": {
              "type": "string",
              "enum": ["oauth2-pkce", "mcp-oauth"],
              "default": "oauth2-pkce",
              "description": "Flow type the worker should drive. oauth2-pkce: pre-registered client, core-minted code_verifier. mcp-oauth: the plugin does MCP-OAuth-2.1 discovery + DCR and bridges begin → complete via the oauthState echo."
            },
            "credentialScope": {
              "type": "string",
              "enum": ["operator", "deployment"],
              "default": "operator",
              "description": "operator: per-operator credentials. deployment: one org-wide credential consented by an admin, injected on every action call and stored under a reserved secrets slot."
            }
          }
        },
        "channel": {
          "type": "object",
          "description": "The plugin is a frontend (channel) — Slack, Telegram, voice, etc. Non-singleton; the worker projects modality-free InteractionEvents into the substrate inside the plugin VM and normalizes inbound payloads back into agent intents.",
          "required": ["providerLabel", "profile", "directions"],
          "additionalProperties": false,
          "properties": {
            "providerLabel": {
              "type": "string",
              "minLength": 1,
              "description": "Display label for the channel (e.g. \"Telegram\", \"Slack\")."
            },
            "directions": {
              "type": "array",
              "minItems": 1,
              "items": { "type": "string", "enum": ["inbound", "outbound"] },
              "description": "Which directions the channel supports."
            },
            "ingress": {
              "type": "string",
              "enum": ["webhook", "socket", "none"],
              "default": "none",
              "description": "How inbound arrives: an HTTP webhook, a persistent socket, or none (outbound-only)."
            },
            "profile": { "$ref": "#/$defs/capabilityProfile" }
          }
        },
        "directory": {
          "type": "object",
          "description": "Lists the identity provider's users, groups and group memberships. Singleton per deployment.",
          "required": ["providerLabel"],
          "additionalProperties": false,
          "properties": {
            "providerLabel": { "type": "string", "minLength": 1 },
            "read": {
              "type": "object",
              "additionalProperties": false,
              "properties": {
                "users": { "type": "boolean" },
                "groups": { "type": "boolean" },
                "memberships": { "type": "boolean" }
              }
            },
            "write": {
              "type": "object",
              "additionalProperties": false,
              "properties": {
                "createUser": { "type": "boolean" },
                "deactivateUser": { "type": "boolean" }
              }
            }
          }
        }
      }
    },
    "capabilityProfile": {
      "type": "object",
      "description": "What the substrate can carry — the only thing a projection may branch on. Additive: new fields default such that existing channels are unaffected, so unknown properties are tolerated.",
      "required": ["modalities", "richMedia", "interaction", "constraints", "fidelity"],
      "properties": {
        "modalities": {
          "type": "array",
          "minItems": 1,
          "items": { "type": "string", "enum": ["text", "visual", "voice", "haptic", "neural"] }
        },
        "richMedia": { "type": "object" },
        "interaction": { "type": "object" },
        "constraints": { "type": "object" },
        "fidelity": { "type": "string", "enum": ["headline", "summary", "full"] }
      }
    },
    "actionDeclaration": {
      "type": "object",
      "required": ["kind", "description"],
      "additionalProperties": false,
      "properties": {
        "kind": {
          "type": "string",
          "pattern": "^[a-z][a-z0-9_]*$",
          "description": "Snake_case action identifier."
        },
        "description": {
          "type": "string",
          "minLength": 1,
          "description": "Short description the agent uses to pick this kind."
        },
        "default_mode": {
          "description": "Seeded approval policy when the plugin is freshly installed. auto = run inline with no human gate (read-only kinds). ask = suspend agent turn, render approval card to the user (externally observable kinds). deny = never invokable without explicit opt-in. Operators can override later in /settings/rules. Defaults to ask when omitted — safer to surprise the user with a prompt than a side effect. Accepts either a scalar (applies to all scopes) or a per-scope object {external?, internal?} when the kind needs different defaults depending on the scope it's invoked under.",
          "oneOf": [
            { "type": "string", "enum": ["auto", "ask", "deny"] },
            {
              "type": "object",
              "additionalProperties": false,
              "properties": {
                "external": { "type": "string", "enum": ["auto", "ask", "deny"] },
                "internal": { "type": "string", "enum": ["auto", "ask", "deny"] }
              }
            }
          ]
        },
        "targets": {
          "description": "Payload fields that hold the action's targets. The host reads the targets from these fields, so approval rules match where the action really goes. value: each value as written. email_domain: the lowercase domain of each email address.",
          "type": "object",
          "required": ["fields"],
          "additionalProperties": false,
          "properties": {
            "fields": { "type": "array", "minItems": 1, "items": { "type": "string", "minLength": 1 } },
            "as": { "type": "string", "enum": ["value", "email_domain"] }
          }
        }
      }
    }
  }
}
