{
  "$schema": "https://open-neko.github.io/plugins/marketplace.schema.json",
  "name": "OpenNeko Official",
  "owner": "open-neko",
  "homepage": "https://open-neko.github.io/plugins/",
  "description": "First-party plugins for OpenNeko. Published by the maintainers under @open-neko/* on npm. Written, tested, and supported by the OpenNeko team.",
  "plugins": [
    {
      "name": "@open-neko/channel-telegram",
      "title": "Telegram channel",
      "description": "Bidirectional Telegram channel: delivers the agent's Briefing, findings, and approvals to a chat (HTML + inline Approve/Reject buttons) and turns replies and button taps back into agent intents. Authenticated via a bot token from @BotFather, stored in the per-user secrets file.",
      "source": "https://github.com/open-neko/plugins/tree/main/packages/telegram",
      "homepage": "https://core.telegram.org/bots/api",
      "maintainers": [
        {
          "name": "open-neko",
          "url": "https://github.com/open-neko"
        }
      ],
      "versions": [
        {
          "version": "0.3.1",
          "integrity": "sha512-fhQgHLdnVkOCfCNDnnAyUmDMNrIZhFzerllcqZGBLJp+Vmrn9lLLxa18wyMXrSD2GEdmZLcI0TlRXYq7A3WDKA==",
          "permissions": {
            "network": [
              "api.telegram.org"
            ],
            "env": [
              {
                "key": "TELEGRAM_BOT_TOKEN",
                "required": true,
                "secret": true,
                "description": "Bot token from @BotFather (e.g. 123456789:AAH...). The plugin calls https://api.telegram.org/bot<token>/sendMessage to deliver."
              },
              {
                "key": "TELEGRAM_WEBHOOK_SECRET",
                "required": false,
                "secret": true,
                "description": "Optional secret_token set via setWebhook; verify_inbound checks Telegram's X-Telegram-Bot-Api-Secret-Token header against it. Not needed for getUpdates long-poll."
              }
            ]
          },
          "capabilities": {
            "channel": {
              "providerLabel": "Telegram",
              "directions": [
                "outbound",
                "inbound"
              ],
              "ingress": "webhook",
              "profile": {
                "modalities": [
                  "text"
                ],
                "richMedia": {
                  "markdown": true,
                  "cards": false,
                  "charts": false,
                  "images": true,
                  "interactiveControls": true
                },
                "interaction": {
                  "turnTaking": "async",
                  "canApproveInline": true,
                  "quickReplies": true
                },
                "constraints": {
                  "maxOutboundChars": 4096,
                  "latencyClass": "interactive",
                  "attentionModel": "push"
                },
                "fidelity": "summary"
              }
            }
          },
          "publishedAt": "2026-06-02"
        },
        {
          "version": "0.3.0",
          "integrity": "sha512-dKx2Ro0X0KdjZkMxTR/tFJt3bIyUl+byq8CUfC/iwNgcs0A6/R6Vxzv1EWniKxEay+h91vE1MLCtXtOr75+XGg==",
          "permissions": {
            "network": [
              "api.telegram.org"
            ],
            "env": [
              {
                "key": "TELEGRAM_BOT_TOKEN",
                "required": true,
                "secret": true,
                "description": "Bot token from @BotFather (e.g. 123456789:AAH...). The plugin calls https://api.telegram.org/bot<token>/sendMessage to deliver."
              },
              {
                "key": "TELEGRAM_WEBHOOK_SECRET",
                "required": false,
                "secret": true,
                "description": "Optional secret_token set via setWebhook; verify_inbound checks Telegram's X-Telegram-Bot-Api-Secret-Token header against it. Not needed for getUpdates long-poll."
              }
            ]
          },
          "capabilities": {
            "channel": {
              "providerLabel": "Telegram",
              "directions": [
                "outbound",
                "inbound"
              ],
              "ingress": "webhook",
              "profile": {
                "modalities": [
                  "text"
                ],
                "richMedia": {
                  "markdown": true,
                  "cards": false,
                  "charts": false,
                  "images": true,
                  "interactiveControls": true
                },
                "interaction": {
                  "turnTaking": "async",
                  "canApproveInline": true,
                  "quickReplies": true
                },
                "constraints": {
                  "maxOutboundChars": 4096,
                  "latencyClass": "interactive",
                  "attentionModel": "push"
                },
                "fidelity": "summary"
              }
            }
          },
          "publishedAt": "2026-05-25"
        },
        {
          "version": "0.2.0",
          "integrity": "sha512-6DCDiVh+CMU6wCuyp3N2RMIhpehs/C0vC2nP08XzFzo/8uK1GLO0YpN4wXYp3RUMcrYBiOvCLyx4+gbuNE/yEw==",
          "provenanceWaived": true,
          "permissions": {
            "network": [
              "api.telegram.org"
            ],
            "env": [
              {
                "key": "TELEGRAM_BOT_TOKEN",
                "required": true,
                "secret": true,
                "description": "Bot token from @BotFather (e.g. 123456789:AAH...). The plugin calls https://api.telegram.org/bot<token>/sendMessage to deliver."
              },
              {
                "key": "TELEGRAM_WEBHOOK_SECRET",
                "required": false,
                "secret": true,
                "description": "Optional secret_token set via setWebhook; verify_inbound checks Telegram's X-Telegram-Bot-Api-Secret-Token header against it. Not needed for getUpdates long-poll."
              }
            ]
          },
          "capabilities": {
            "channel": {
              "providerLabel": "Telegram",
              "directions": [
                "outbound",
                "inbound"
              ],
              "ingress": "webhook",
              "profile": {
                "modalities": [
                  "text"
                ],
                "richMedia": {
                  "markdown": true,
                  "cards": false,
                  "charts": false,
                  "images": true,
                  "interactiveControls": true
                },
                "interaction": {
                  "turnTaking": "async",
                  "canApproveInline": true,
                  "quickReplies": true
                },
                "constraints": {
                  "maxOutboundChars": 4096,
                  "latencyClass": "interactive",
                  "attentionModel": "push"
                },
                "fidelity": "summary"
              }
            }
          },
          "publishedAt": "2026-05-25"
        },
        {
          "version": "0.4.0",
          "integrity": "sha512-VyemqbEcmj3q90JWyQd6m9WOQP7ml8J2Aa7IUSvVPoc48bzyIStBSj14UDNshex6bZDz+uN+Ytih2tyT04zr3A==",
          "permissions": {
            "network": [
              "api.telegram.org"
            ],
            "env": [
              {
                "key": "TELEGRAM_BOT_TOKEN",
                "required": true,
                "secret": true,
                "description": "Bot token from @BotFather (e.g. 123456789:AAH...). The plugin calls https://api.telegram.org/bot<token>/sendMessage to deliver."
              },
              {
                "key": "TELEGRAM_WEBHOOK_SECRET",
                "required": false,
                "secret": true,
                "description": "Optional secret_token set via setWebhook; verify_inbound checks Telegram's X-Telegram-Bot-Api-Secret-Token header against it. Not needed for getUpdates long-poll."
              }
            ]
          },
          "capabilities": {
            "channel": {
              "providerLabel": "Telegram",
              "directions": [
                "outbound",
                "inbound"
              ],
              "ingress": "webhook",
              "profile": {
                "modalities": [
                  "text"
                ],
                "richMedia": {
                  "markdown": true,
                  "cards": false,
                  "charts": false,
                  "images": true,
                  "interactiveControls": true
                },
                "interaction": {
                  "turnTaking": "async",
                  "canApproveInline": true,
                  "quickReplies": true
                },
                "constraints": {
                  "maxOutboundChars": 4096,
                  "latencyClass": "interactive",
                  "attentionModel": "push"
                },
                "fidelity": "summary"
              }
            }
          },
          "publishedAt": "2026-06-11"
        },
        {
          "version": "0.5.0",
          "integrity": "sha512-FqMkx69a97sACbBGQOjGGFbpljJsScsDDNweiT0/sNXU6iM6B8Eo9Vl1OYt9owFLcT5DvIA3GxFhcGJS0R2WFQ==",
          "permissions": {
            "network": [
              "api.telegram.org"
            ],
            "env": [
              {
                "key": "TELEGRAM_BOT_TOKEN",
                "required": true,
                "secret": true,
                "description": "Bot token from @BotFather (e.g. 123456789:AAH…). The plugin calls https://api.telegram.org/bot<token>/sendMessage to deliver. When unset at exec time the plugin runs in dry-run mode — it still projects the native payload but sends nothing."
              },
              {
                "key": "TELEGRAM_WEBHOOK_SECRET",
                "required": false,